{"$schema":"http://json-schema.org/draft-07/schema#","additionalProperties":false,"properties":{"checked_at":{"type":"string"},"events":{"items":{"additionalProperties":false,"properties":{"address":{"type":["string","null"]},"artist":{"type":"string"},"bill":{"items":{"type":"string"},"type":"array"},"city":{"type":["string","null"]},"date":{"pattern":"^\\d{4}-\\d{2}-\\d{2}$","type":"string"},"discrepancies":{"items":{"type":"string"},"type":"array"},"id":{"type":"string"},"kind":{"type":"string"},"note":{"type":"string"},"price":{"type":["string","null"]},"sources":{"items":{"additionalProperties":false,"properties":{"label":{"type":"string"},"url":{"type":"string"}},"required":["label","url"],"type":"object"},"type":"array"},"status":{"enum":["verified","single-source","unconfirmed"]},"time":{"type":["string","null"]},"title":{"type":"string"},"venue":{"type":["string","null"]},"weekday":{"type":"string"}},"required":["id","artist","kind","title","date","weekday","status","sources","note"],"type":"object"},"type":"array"},"sweep":{"type":"string"},"unconfirmed":{"items":{"additionalProperties":false,"properties":{"artist":{"type":"string"},"id":{"type":"string"},"note":{"type":"string"},"sources":{"type":"array"},"status":{"const":"unconfirmed"},"title":{"type":"string"}},"required":["id","artist","title","status","note"],"type":"object"},"type":"array"},"version":{"type":"string"}},"required":["version","checked_at","sweep","events","unconfirmed"],"title":"Live-date verification board","type":"object"}