{"checked_at":"2026-10-13","events":[{"address":"1906 Cypress Avenue, Los Angeles, CA 90065","artist":"Fish Narc","bill":["Fish Narc"],"city":"Los Angeles, CA","date":"2026-10-15","discrepancies":["JamBase's schedule for the same venue and evening lists Sam Buck (9:00 PM) and does not list Fish Narc. A shared bill or a listing lag would explain it; the sweep records the conflict instead of resolving it. The free/RSVP detail rests on the venue calendar alone."],"id":"fish-narc-uncle-listening-party","kind":"listening party","note":"Bandsintown independently corroborates the date, venue and 7:00 PM start first recorded from the venue calendar in the 2026-10-12 research pass. The night before the 'Uncle' release. Re-checked 2026-10-13: Bandsintown still carries Thu Oct 15, 7:00 PM PDT at this venue, and the JamBase conflict below still stands.","price":"Free, RSVP","sources":[{"label":"Venue calendar — Permanent Records Roadhouse","url":"https://roadhouse.permanentrecordsla.com/"},{"label":"Fish Narc at Permanent Records Roadhouse, Oct 15 2026 — Bandsintown","url":"https://www.bandsintown.com/e/1040142530-fish-narc-at-permanent-records-roadhouse?came_from=253&utm_medium=web&utm_source=city_page&utm_campaign=just_announced"}],"status":"verified","time":"7:00 PM PDT","title":"'Uncle' listening party","venue":"Permanent Records Roadhouse","weekday":"Thursday"},{"address":null,"artist":"Fish Narc","bill":["Fish Narc"],"city":null,"date":"2026-10-16","discrepancies":[],"id":"fish-narc-uncle-release","kind":"album release","note":"Independent listings still carry 2026-10-16 as upcoming. Re-checked 2026-10-13: Faygoluvers, crawled hours before this sweep, still gives October 16, 2026 as the release date via K Records — no early release, no date change, no third single found. The archive's watch stays 'announced' until a post-release pass confirms it is out.","price":null,"sources":[{"label":"fish narc announces new album 'Uncle' — Stereogum","url":"https://stereogum.com/2508537/fish-narc-announces-new-album-uncle-hear-much-less-me/music"},{"label":"2026 album releases (October calendar) — AltPress","url":"https://www.altpress.com/2026-album-releases/"},{"label":"Upcoming album releases — Consequence","url":"http://consequence.net/upcoming-releases/"},{"label":"Fish Narc — upcoming releases — upcomingvinyl","url":"https://upcomingvinyl.com/artists/fish-narc"},{"label":"Fish Narc artist profile — Release Wave","url":"https://releasewave.com/artists/fish-narc"},{"label":"Fish Narc announces new album 'Uncle' on K Records — Faygoluvers","url":"https://www.faygoluvers.net/v5/2026/09/fish-narc-announces-new-album-uncle-on-k-records/"}],"status":"verified","time":null,"title":"'Uncle' — fifth solo LP (K Records, KLP313)","venue":null,"weekday":"Friday"},{"address":"116 S Washington St, Seattle, WA 98104","artist":"capoxxo","bill":["Korpsebunny","capoxxo","mayh3mp","Scarly"],"city":"Seattle, WA","date":"2026-10-28","discrepancies":[],"id":"korpsebunny-seattle-capoxxo","kind":"support slot","note":"Primary listing opened directly in the 2026-10-12 sweep: all ages, Korpsebunny's first Seattle show, hosted by Heady Presents. capoxxo plays a support slot — he is not the headliner. Re-checked 2026-10-13 against the same Eventbrite listing: date, doors, price and bill unchanged.","price":"$25.63","sources":[{"label":"Korpsebunny - Seattle (w/ Capoxxo and mayh3mp) — Eventbrite (Heady Presents)","url":"https://www.eventbrite.com/e/korpsebunny-seattle-w-capoxxo-and-mayh3mp-tickets-2002391650329"}],"status":"verified","time":"Doors 7:30 PM · show 7:30–11:30 PM","title":"Korpsebunny — Seattle (w/ Capoxxo and mayh3mp)","venue":"Arch Rivals Studios","weekday":"Wednesday"},{"address":"211 Southeast Madison Street, Portland, OR 97214","artist":"capoxxo","bill":["Korpsebunny","capoxxo","mayh3mp","Eunhae","Scarly","B3xtac33 (DJ)","DJ Shortstop","Sora Boyd (DJ)"],"city":"Portland, OR","date":"2026-10-29","discrepancies":["Songkick still reads 'off tour — no upcoming concerts' for capoxxo. Headliner trackers do not carry support slots; the Eventbrite listing is the primary source and stands."],"id":"korpsebunny-portland-capoxxo","kind":"support slot","note":"Primary listing opened directly in the 2026-10-12 sweep: all ages. The Portland room is listed by street address only — no venue name on the listing. Re-checked 2026-10-13 against the same Eventbrite listing: date, doors, price and bill unchanged.","price":"$28.52","sources":[{"label":"Korpsebunny - PDX (w/ Capoxxo, mayh3mp) — Eventbrite (Heady Presents)","url":"https://www.eventbrite.com/e/korpsebunny-pdx-w-capoxxo-mayh3mp-tickets-2002981653043"},{"label":"capoxxo tour status — Songkick","url":"https://www.songkick.com/artists/9749264-capoxxo"}],"status":"verified","time":"Doors 7:00 PM · show 7:30–11:30 PM","title":"Korpsebunny — PDX (w/ Capoxxo, mayh3mp)","venue":"211 SE Madison St","weekday":"Thursday"},{"address":"5632 Santa Monica Blvd, Los Angeles, CA 90038","artist":"Fish Narc","bill":["Fish Narc","Sepe"],"city":"Los Angeles, CA","date":"2026-10-29","discrepancies":[],"id":"fish-narc-los-angeles-gold-diggers","kind":"headline show","note":"Three independent sources now carry the date and venue: Stereogum's tour list, RIFF, and a dedicated JamBase show listing, which adds a 7:00 PM start and the venue's street address (both new in the 2026-10-13 sweep). No primary ticket listing has been opened, so the price stays unrecorded rather than guessed. Same night capoxxo plays Portland — two archive orbits, one evening.","price":null,"sources":[{"label":"fish narc announces new album 'Uncle' (tour dates) — Stereogum","url":"https://stereogum.com/2508537/fish-narc-announces-new-album-uncle-hear-much-less-me/music"},{"label":"Tuesday Tracks (Sept 22) — RIFF Magazine","url":"https://riffmagazine.com/tuesday-tracks/the-hails-20260922/"},{"label":"Fish Narc at Gold Diggers, Oct 29 2026 — JamBase","url":"https://www.jambase.com/show/fish-narc-gold-diggers-20261029"}],"status":"verified","time":"7:00 PM","title":"Fish Narc — Los Angeles, Gold Diggers","venue":"Gold Diggers","weekday":"Thursday"},{"address":null,"artist":"Fish Narc","bill":["Fish Narc"],"city":"Kingston, NY","date":"2026-11-06","discrepancies":[],"id":"fish-narc-kingston-tubbys","kind":"headline show","note":"Carried by the Stereogum announcement's tour list only, in every pass so far. No venue listing opened yet.","price":null,"sources":[{"label":"fish narc announces new album 'Uncle' (tour dates) — Stereogum","url":"https://stereogum.com/2508537/fish-narc-announces-new-album-uncle-hear-much-less-me/music"}],"status":"single-source","time":null,"title":"Fish Narc — Kingston, Tubby's","venue":"Tubby's","weekday":"Friday"},{"address":null,"artist":"Fish Narc","bill":["Fish Narc","Loosey"],"city":"Ridgewood, NY","date":"2026-11-07","discrepancies":[],"id":"fish-narc-ridgewood-stone-circle","kind":"headline show","note":"Carried by the Stereogum announcement's tour list only, in every pass so far. No venue listing opened yet.","price":null,"sources":[{"label":"fish narc announces new album 'Uncle' (tour dates) — Stereogum","url":"https://stereogum.com/2508537/fish-narc-announces-new-album-uncle-hear-much-less-me/music"}],"status":"single-source","time":null,"title":"Fish Narc — Ridgewood, Stone Circle Theatre","venue":"Stone Circle Theatre","weekday":"Saturday"}],"sweep":"Live-date verification sweep, first swept 2026-10-12 (Signal 2.0 wave), re-swept 2026-10-13 (Signal 2.1). Each event was checked against the web on the stated date. Status rules: 'verified' = a primary listing (ticketing/venue) or two independent sources carry the same date, venue and time; 'single-source' = exactly one source carries it; 'unconfirmed' = mentioned without dates or a listing. Discrepancies are recorded, never smoothed over. Weekdays were computed from the calendar and match the listings' own weekday claims.","unconfirmed":[{"artist":"Fish Narc","id":"uncle-europe-leg","note":"upcomingvinyl's promo copy mentions an autumn US+Europe tour with a full band. No European dates, cities or venues have been published anywhere the sweep can reach. Recorded as a lead, not a date.","sources":[{"label":"Fish Narc — upcoming releases — upcomingvinyl","url":"https://upcomingvinyl.com/artists/fish-narc"}],"status":"unconfirmed","title":"'Uncle' Europe leg"},{"artist":"Fish Narc","id":"uncle-third-single","note":"Two singles are out ('Much Less Me', 'Big Dumb World'). No third single, advance review or release-week interview surfaced in this sweep — normal four days out, and recorded so the next sweep can tell 'still none' from 'not checked'.","sources":[],"status":"unconfirmed","title":"A third 'Uncle' single"}],"version":"0.19.0"}